{
  "$schema": "../schema.json",
  "name": "malware-analysis",
  "logging": {
    "path": "logs/malware-analysis.jsonl",
    "stdout": false,
    "max_bytes_per_entry": 131072
  },
  "target": {
    "launch": "C:/Sandbox/sample.exe",
    "arguments": "",
    "working_directory": "C:/Sandbox"
  },
  "modules": [
    "network.winhttp",
    "network.winhttp.extended",
    "network.urlmon",
    "network.wininet",
    "network.winsock",
    "network.win32web",
    {
      "name": "crypto.bcrypt",
      "enabled": true,
      "allow_in_attach": false
    },
    "crypto.cryptapi"
  ]
}
